{
  "format": "whatsonmyballot-notes",
  "schemaVersion": "1.1.0",
  "datasetId": "b7c-fictional-ballot-demo",
  "revision": 0,
  "records": [
    {
      "id": "contest-straight-party",
      "kind": "section",
      "raceId": "contest-straight-party",
      "label": "Straight Party Ticket",
      "synopsis": "",
      "author": "",
      "opinion": "",
      "sourceUrl": "",
      "headerHighlighted": false,
      "headerColor": "red"
    },
    {
      "id": "demo-group-01",
      "kind": "party",
      "raceId": "contest-straight-party",
      "label": "Example Group A",
      "synopsis": "This is a fictional entry used to test the ballot display.",
      "author": "Sample editor B (fictional)",
      "opinion": "This is filler text for a layout check. It does not describe a real person or group.",
      "sourceUrl": ""
    },
    {
      "id": "demo-group-02",
      "kind": "party",
      "raceId": "contest-straight-party",
      "label": "Example Group B",
      "synopsis": "This is a fictional entry used to test the ballot display.",
      "author": "Sample editor C (fictional)",
      "opinion": "An editor can use this space for a short note. This example lets you check the text size and spacing.",
      "sourceUrl": ""
    },
    {
      "id": "demo-group-03",
      "kind": "party",
      "raceId": "contest-straight-party",
      "label": "Example Group C",
      "synopsis": "This is a fictional entry used to test the ballot display.",
      "author": "Sample editor A (fictional)",
      "opinion": "This sample has two short sentences. The text is here to show how the panel opens below the row.",
      "sourceUrl": ""
    },
    {
      "id": "demo-group-04",
      "kind": "party",
      "raceId": "contest-straight-party",
      "label": "Example Group D",
      "synopsis": "",
      "author": "",
      "opinion": "",
      "sourceUrl": ""
    },
    {
      "id": "demo-group-05",
      "kind": "party",
      "raceId": "contest-straight-party",
      "label": "Example Group E",
      "synopsis": "This is a fictional entry used to test the ballot display.",
      "author": "Sample editor C (fictional)",
      "opinion": "This sample note shows the space used by an opinion. You can replace it in Admin.",
      "sourceUrl": ""
    },
    {
      "id": "demo-group-06",
      "kind": "party",
      "raceId": "contest-straight-party",
      "label": "Example Group F",
      "synopsis": "This is a fictional entry used to test the ballot display.",
      "author": "Sample editor A (fictional)",
      "opinion": "This is filler text for a layout check. It does not describe a real person or group.",
      "sourceUrl": ""
    },
    {
      "id": "demo-group-07",
      "kind": "party",
      "raceId": "contest-straight-party",
      "label": "Example Group G",
      "synopsis": "This is a fictional entry used to test the ballot display.",
      "author": "",
      "opinion": "",
      "sourceUrl": ""
    },
    {
      "id": "contest-president",
      "kind": "section",
      "raceId": "contest-president",
      "label": "Electors of President and Vice-President of the United States",
      "synopsis": "This is a fictional entry used to test the ballot display.",
      "author": "Sample editor C (fictional)",
      "opinion": "This sample has two short sentences. The text is here to show how the panel opens below the row.",
      "sourceUrl": "",
      "headerHighlighted": true,
      "headerColor": "red"
    },
    {
      "id": "demo-candidate-001",
      "kind": "candidate",
      "raceId": "contest-president",
      "label": "Sample Person 01A / Sample Person 01B",
      "synopsis": "This is a fictional entry used to test the ballot display.",
      "author": "Sample editor A (fictional)",
      "opinion": "This is another layout example. You can hide the guide and still open this note.",
      "sourceUrl": ""
    },
    {
      "id": "demo-candidate-002",
      "kind": "candidate",
      "raceId": "contest-president",
      "label": "Sample Person 02A / Sample Person 02B",
      "synopsis": "This is a fictional entry used to test the ballot display.",
      "author": "Sample editor B (fictional)",
      "opinion": "This sample note shows the space used by an opinion. You can replace it in Admin.",
      "sourceUrl": ""
    },
    {
      "id": "demo-candidate-003",
      "kind": "candidate",
      "raceId": "contest-president",
      "label": "Sample Person 03A / Sample Person 03B",
      "synopsis": "This is a fictional entry used to test the ballot display.",
      "author": "",
      "opinion": "",
      "sourceUrl": ""
    },
    {
      "id": "demo-candidate-004",
      "kind": "candidate",
      "raceId": "contest-president",
      "label": "Sample Person 04A / Sample Person 04B",
      "synopsis": "This is a fictional entry used to test the ballot display.",
      "author": "Sample editor A (fictional)",
      "opinion": "An editor can use this space for a short note. This example lets you check the text size and spacing.",
      "sourceUrl": ""
    },
    {
      "id": "demo-candidate-005",
      "kind": "candidate",
      "raceId": "contest-president",
      "label": "Sample Person 05A / Sample Person 05B",
      "synopsis": "This is a fictional entry used to test the ballot display.",
      "author": "",
      "opinion": "",
      "sourceUrl": ""
    },
    {
      "id": "demo-candidate-006",
      "kind": "candidate",
      "raceId": "contest-president",
      "label": "Sample Person 06A / Sample Person 06B",
      "synopsis": "This is a fictional entry used to test the ballot display.",
      "author": "Sample editor C (fictional)",
      "opinion": "This is another layout example. You can hide the guide and still open this note.",
      "sourceUrl": ""
    },
    {
      "id": "demo-candidate-007",
      "kind": "candidate",
      "raceId": "contest-president",
      "label": "Sample Person 07A / Sample Person 07B",
      "synopsis": "This is a fictional entry used to test the ballot display.",
      "author": "Sample editor A (fictional)",
      "opinion": "This sample note shows the space used by an opinion. You can replace it in Admin.",
      "sourceUrl": ""
    },
    {
      "id": "demo-candidate-008",
      "kind": "candidate",
      "raceId": "contest-president",
      "label": "Sample Person 08A / Sample Person 08B",
      "synopsis": "This is a fictional entry used to test the ballot display.",
      "author": "",
      "opinion": "",
      "sourceUrl": ""
    },
    {
      "id": "write-in-5ac76d70-3476-49f9-a646-1af056d0e60d",
      "kind": "write-in",
      "raceId": "contest-president",
      "label": "Write-in 1 / Electors of President and Vice-President of the United States",
      "synopsis": "",
      "author": "",
      "opinion": "",
      "sourceUrl": ""
    },
    {
      "id": "contest-us-senate",
      "kind": "section",
      "raceId": "contest-us-senate",
      "label": "United States Senator",
      "synopsis": "This is a fictional entry used to test the ballot display.",
      "author": "Sample editor A (fictional)",
      "opinion": "This sample has two short sentences. The text is here to show how the panel opens below the row.",
      "sourceUrl": "",
      "headerHighlighted": false,
      "headerColor": "red"
    },
    {
      "id": "demo-candidate-009",
      "kind": "candidate",
      "raceId": "contest-us-senate",
      "label": "Sample Person 09",
      "synopsis": "This is a fictional entry used to test the ballot display.",
      "author": "",
      "opinion": "",
      "sourceUrl": ""
    },
    {
      "id": "demo-candidate-010",
      "kind": "candidate",
      "raceId": "contest-us-senate",
      "label": "Sample Person 10",
      "synopsis": "This is a fictional entry used to test the ballot display.",
      "author": "",
      "opinion": "",
      "sourceUrl": ""
    },
    {
      "id": "demo-candidate-011",
      "kind": "candidate",
      "raceId": "contest-us-senate",
      "label": "Sample Person 11",
      "synopsis": "This is a fictional entry used to test the ballot display.",
      "author": "Sample editor A (fictional)",
      "opinion": "This is filler text for a layout check. It does not describe a real person or group.",
      "sourceUrl": ""
    },
    {
      "id": "demo-candidate-012",
      "kind": "candidate",
      "raceId": "contest-us-senate",
      "label": "Sample Person 12",
      "synopsis": "This is a fictional entry used to test the ballot display.",
      "author": "Sample editor B (fictional)",
      "opinion": "An editor can use this space for a short note. This example lets you check the text size and spacing.",
      "sourceUrl": ""
    },
    {
      "id": "demo-candidate-013",
      "kind": "candidate",
      "raceId": "contest-us-senate",
      "label": "Sample Person 13",
      "synopsis": "This is a fictional entry used to test the ballot display.",
      "author": "",
      "opinion": "",
      "sourceUrl": ""
    },
    {
      "id": "demo-candidate-014",
      "kind": "candidate",
      "raceId": "contest-us-senate",
      "label": "Sample Person 14",
      "synopsis": "This is a fictional entry used to test the ballot display.",
      "author": "Sample editor A (fictional)",
      "opinion": "This is another layout example. You can hide the guide and still open this note.",
      "sourceUrl": ""
    },
    {
      "id": "write-in-83ebde8a-15d8-4385-89a3-3aa57fe26014",
      "kind": "write-in",
      "raceId": "contest-us-senate",
      "label": "Write-in 1 / United States Senator",
      "synopsis": "This is a fictional entry used to test the ballot display.",
      "author": "",
      "opinion": "",
      "sourceUrl": ""
    },
    {
      "id": "contest-us-house-mi-09",
      "kind": "section",
      "raceId": "contest-us-house-mi-09",
      "label": "Representative in Congress 9th District",
      "synopsis": "This is a fictional entry used to test the ballot display.",